id,title,abstract,patent_date,year
11856881,"Detection of plant diseases with multi-stage, multi-scale deep learning","A computer system is provided comprising a classification model management server computer configured, by instructions, to: receive a new image from a user device; apply a first digital model to first regions within the new image for classifying each of the first regions into a particular class; apply a second digital model to second regions within the new image for classifying each of the second regions into a particular class; and transmit classification data related to the class of the first regions and the class of the second regions to the user device. In connection therewith, the second regions each generally correspond to a combination of multiple first regions.",2024-01-02,2024
11856943,"Control system, agricultural utility vehicle and method for controlling an agricultural utility vehicle","A control system for an agricultural utility vehicle includes a distributor linkage for applying fertilizer, plant protection agents, or seed, the distributor linkage having a center part and two lateral extension arms. The center part is arranged so that it can be moved along a vertical axis to adjust the height of the distributor linkage. At least three sensors for determining the distance between the center part and a respective extension arm to the ground are assigned to the distributor linkage, and the system includes a data processing unit such that signals from the sensors are processed as actual values to generate an actuating signal for a hydraulic device is generated for adaptation to a target distance.",2024-01-02,2024
11857204,Surgical instrument,"A surgical instrument (25), in particular a surgical cutting or drilling instrument, the surgical instrument (25) comprising: a drive unit; a cutting tool or drill bit (5) engageable with the drive unit; a measuring device (1) which is configured to measure the distance [x(t)] covered by the cutting tool or drill bit (5) along a cutting or drilling path with respect to time and relative to a reference position; a processing un and a digital data storage, wherein in the digital data storage reference data are stored which include at least N one data set specifying a reference graph GRef within a time window (11) in the range of a transition and defining a reference point of a transition (21′), wherein the time window (11) includes a first time period before the reference point of a transition (21′) and a second time period after the reference point of a transition (21′) and wherein the processing unit (14) suitably programmed to compare the recorded graph G with the at least one reference graph GRef and to find 1 lion of a transition (21) in the recorded graph G.",2024-01-02,2024
11857257,Functional oct data processing,"A method of processing functional OCT image data, acquired by an OCT scanner scanning a retina that is being repeatedly stimulated by a light stimulus, to obtain a response of the retina to the light stimulus, comprising: receiving OCT image data generated by the OCT scanner repeatedly scanning the retina over a time period, and a sequence of stimulus indicators each indicative of a stimulation of the retina by the light stimulus in a respective time interval of a sequence of time intervals spanning the time period; calculating, for each stimulus indicator, a product of the stimulus indicator and a respective windowed portion of the sequence of B-scans comprising a B-scan based on a portion of the OCT image data generated while the retina was being stimulated in accordance with the stimulus indicator; and combining the calculated products to generate the indication of the response.",2024-01-02,2024
11857271,Markerless navigation using AI computer vision,"Provided herein are devices, systems, and methods for a three-dimensional registering, tracking, and/or guiding an object of interest, such a body part, a surgical tool, or an implant, during a surgical procedure. Such devices, systems, and methods may offer minimally invasive, high precision registering, tracking, and/or guiding of the object of interest using a patterned light beam and data processing using artificial intelligence. The methods, devices, and systems disclosed herein may be compatible with a simple marker or markers placed by a minimally invasive method on the object of interest.",2024-01-02,2024
11857288,Systems and methods for phase unwrapping for dense MRI using deep learning,"A method of cardiac strain analysis uses displacement encoded magnetic resonance image (MRI) data of a heart of the subject and includes generating a phase image for each frame of the displacement encoded MRI data. Phase images include potentially phase-wrapped measured phase values corresponding to pixels of the frame. A convolutional neural network CNN computes a wrapping label map for the phase image, and the wrapping label map includes a respective number of phase wrap cycles present at each pixel in the phase image. Computing an unwrapped phase image includes adding a respective phase correction to each of the potentially-wrapped measured phase values of the phase image, and the phase correction is based on the number of phase wrap cycles present at each pixel. Computing myocardial strain follows by using the unwrapped phase image for strain analysis of the subject.",2024-01-02,2024
11857323,System and method for camera-based stress determination,"A system and method for camera-based stress determination. The method includes: determining a plurality of regions-of-interest (ROIs) of a body part; determining a set of bitplanes in a captured image sequence for each ROI that represent HC changes using a trained machine learning model, the machine learning model trained with a hemoglobin concentration (HC) changes training set, the HC changes training set trained using bitplanes from previously captured image sequences of other human individuals as input and received cardiovascular data as targets; determining an HC change signal for each of the ROIs based on changes in the set of determined bitplanes; for each ROI, determining intervals between heartbeats based on peaks in the HC change signal; determining heart rate variability using the intervals between heartbeats; determining a stress level using at least one determination of a standard deviation of the heart rate variability; and outputting the stress level.",2024-01-02,2024
11857331,Force measurement system,"A force measurement system is disclosed herein. The force measurement system includes at least one user input device, a force measurement assembly configured to receive a subject, at least one visual display device, and one or more data processing devices operatively coupled to the user input device, the force measurement assembly, and the visual display device. The one or more data processing devices being programmed to receive the one or more input signals from the user input device based upon one or more selections by the user, the one or more selections including a scene movement setting and a force measurement assembly movement setting; display the one or more scenes on the output screen of the at least one visual display based upon the scene movement setting selected by the user; and control the force measurement assembly based upon the force measurement assembly movement setting selected by the user.",2024-01-02,2024
11857351,Robotic surgical system and method,"A robotic surgical system is provided that includes a robot connected to a computer system to help effect control of the robot. A tool is removably mounted to a distal end of a robot arm. The tool is adapted to selectively grip, move and drive an effector and a coupled fastener. The fastener is used in orthopedic surgery, and the effector is uncoupled from the fastener after it is inserted in a patient.",2024-01-02,2024
11857759,System for detecting and reporting fluid levels in an infusion device,"This disclosure addresses a monitoring device for an infusion system. The device is typically used with an infusion device utilizing a clear reservoir bag holding the supplied fluid. The device uses light sources and sensors to accurately determine the level of the fluid, the amount of fluid being supplied, and when replenishment of the fluid is required. In addition, the device may utilize ultrasound sources and sensors as backups to the light system. The device further includes a data processing module that gathers, stores, and reports data relative to the fluid flow properties of the infusion device.",2024-01-02,2024
11857841,Performance monitoring system for a pitcher,"A performance monitoring system includes a pitching mound, one or more processors, and a memory. The pitching mound includes a piezoelectric film associated with a pitching rubber, one or more rubber layers covering the piezoelectric film, a transmitter electrically coupled to the piezoelectric film, and a power source powering an amplifier associated with the piezoelectric film. The piezoelectric film generates electrical signals in response to pressure exerted on the pitching rubber. The processors are configured to receive the electrical signals generated by the piezoelectric film and transmitted by the transmitter. The processor is configured to analyze the received electrical signals based on training data using machine learning algorithms to determine at least one performance characteristic of the pitcher. The processors are configured to display on a display device the determined at least one performance characteristic in real-time.",2024-01-02,2024
11857868,Automated controller configuration recommendation system,"Various aspects of the subject technology relate to systems, methods, and machine- readable media for adjusting controller settings. The method includes receiving, through a controller associated with a user, controller input for software. The method also includes determining, based on the controller input, a user profile for the user comprising at least a skill level and an input tendency of the user. The method also includes providing suggested adjustments to the controller settings intended to improve performance of the user in relation to the software, the controller settings comprising at least one of controller sensitivity or controller assignments. The method also includes receiving approval of the user to implement the suggested adjustments to the controller settings. The method also includes adjusting the controller settings based on the approval of the user.",2024-01-02,2024
11857872,Content adaptive data center routing and forwarding in cloud computing environments,"High performance applications—such as cloud game streaming, cloud virtual reality (VR), remote desktop, and others—are sensitive to various network conditions, such as latency, jitter, and packet loss. Systems of the present disclosure may match network characteristics for a user device with latency requirements for a particular application type, and application sessions may be forwarded or distributed to a suitable data center. To accomplish this, application specific network tests may be executed to determine requirements for executing a high performing application session for a user. The result of these tests, in addition to application specific performance requirements, may be used to find a suitable data center—from a set of available data centers—that is capable of hosting the application session without degradation. As a result, efficient use of distributed infrastructures may be accomplished, while avoiding congestion and hot-spots, and providing an optimized application experience for end users.",2024-01-02,2024
11858122,Ground based robot with an OGI camera with computer vision to automate the inspection,"Provided is a process including: obtaining a first set of one or more images generated via an optical gas imaging (OGI) camera and a second set of one or more images generated via a second camera, wherein the first set and the second set correspond to a first location of a plurality of locations in a facility; classifying, via a convolutional neural network (CNN), the first set of one or more images according to whether the one or more images depict a gas leak; and storing a result of classifying the first set in memory.",2024-01-02,2024
11858149,Localization of robot,"A robot may include an input interface configured to obtain an image of a surrounding environment of the robot, and at least one processor configured to rotate the robot in place for localization, and estimate at least one of a position or a pose in a space, based on a plurality of sequential images obtained by the input interface during the rotation of the robot. The position or the pose of the robot may be estimated based on inputting the plurality of sequential images obtained during the rotation of the robot into a trained model based on an artificial neural network. In a 5G environment connected for the Internet of Things, embodiments of the present disclosure may execute an artificial intelligence algorithm and/or a machine learning algorithm.",2024-01-02,2024
11858207,Defect detection for additive manufacturing systems,"This invention teaches a quality assurance system for additive manufacturing. This invention teaches a multi-sensor, real-time quality system including sensors, affiliated hardware, and data processing algorithms that are Lagrangian-Eulerian with respect to the reference frames of its associated input measurements. The quality system for Additive Manufacturing is capable of measuring true in-process state variables associated with an additive manufacturing process, i.e., those in-process variables that define a feasible process space within which the process is deemed nominal. The in-process state variables can also be correlated to the part structure or microstructure and can then be useful in identifying particular locations within the part likely to include defects.",2024-01-02,2024
11858356,System and method for managing energy consumption across electric vehicle fleets with telematic devices in a computing environment,"A system and method for managing energy consumption across a fleet of telematic devices in a computing environment. The method includes receiving real time vehicle operation data from a fleet of telematic devices. The method further includes processing the received real time vehicle operation data using one or more artificial intelligence device integration models. Further, the method includes generating artificial intelligence-based energy management models for the fleet of telematic devices based on the real time vehicle operation data. Additionally, the method includes generating one or more energy management decisions for the fleet of telematic devices based on the generated one or more artificial intelligence-based energy management models. The method further includes managing the generated one or more energy management decisions for the fleet of telematic devices using a web application.",2024-01-02,2024
11858508,Trajectory prediction from precomputed or dynamically generated bank of trajectories,"Among other things, techniques are described for predicting how an agent (e.g., a vehicle, bicycle, pedestrian, etc.) will move in an environment based on prior movement, the road network, the surrounding objects and/or other relevant environmental factors. One trajectory prediction technique involves generating a probability map for an agent's movement. Another trajectory prediction technique involves generating a trajectory lattice, for an agent's movement. In addition, a different trajectory prediction technique involves multi-modal regression where a classifier (e.g., a neural network) is trained to classify the probability of a number of (learned) modes such that each model produces a trajectory based on the current input.",2024-01-02,2024
11858514,Top-down scene discrimination,"Techniques for top-down scene discrimination are discussed. A system receives scene data associated with an environment proximate a vehicle. The scene data is input to a convolutional neural network (CNN) discriminator trained using a generator and a classification of the output of the CNN discriminator. The CNN discriminator generates an indication of whether the scene data is a generated scene or a captured scene. If the scene data is data generated scene, the system generates a caution notification indicating that a current environmental situation is different from any previous situations. Additionally, the caution notification is communicated to at least one of a vehicle system or a remote vehicle monitoring system.",2024-01-02,2024
11858543,System and method for controlling operations of a train using energy management machine learning models,"A train control system uses artificial intelligence for maintaining synchronization between centralized and distributed train control models. A machine learning engine receives training data from a data acquisition hub, a first set of output control commands from a centralized virtual system modeling engine, and a second set of output control commands from a distributed virtual system modeling engine. The machine learning engine compares the first set of output control commands and the second set of output control commands, and trains a learning system using the training data to enable the machine learning engine to safely mitigate any difference between the first and second sets of output control commands using a learning function including at least one learning parameter.",2024-01-02,2024
11858551,"Modular, cost effective, field repairable chassis and mechanical components for heavy duty autonomous robot","A modular, cost-effective, field repairable chassis and mechanical components for an heavy duty autonomous robot having a uni-member bended frame 200 having a first end 210, a second end 220 and a middle section 240 whereby the uni-member bended frame 200 is configured to easily connect and remove the following body parts: a first set of rotatable members 310 removably affixable at the first end; a second set of rotatable members 320 removably affixable at the second end; at least one battery 330; at least one solar panel 340; at least one electric motor 350; at least one gearing mechanism 360 that is connectable to the at least one electric motor 350 and to at least one of the first and the second set of rotatable members 310, 320; at least one sensor 370; and at least one computer system 380. ",2024-01-02,2024
11858651,Machine learning model development with interactive feature construction and selection,"Subject matter described herein includes generating a visual environment for interactive development of a machine learning (ML) model. The method includes accessing observations of data each of which includes values of independent variables and a dependent variable. The method includes performing an interactive feature construction and selection in which select independent variables are selected as or transformed into a set of features for use in building a ML model to predict the dependent variable. The method includes building the ML model using a ML algorithm, the set of features, and a training set produced from the set of features and observations of the data. And the method includes outputting the ML model for deployment to predict the dependent variable for additional observations of the data.",2024-01-02,2024
11858796,Capper/decapper system and method,"A system and method for gripping, torqueing and releasing an element so as to cap and/or decap a container, such as those typically utilized to house specimens in laboratory environments. The system is driven by a single bi-directional motor linked to a coupler assembly via a rotating threaded shaft. The coupler assembly is configured to engage with an element, such as a cap or container, via mechanically-biased splines that are actuated without any complex linkages, or operative connection to the motor or other powered components. The system employs an ejector nut and an ejector, both of which are concentrically positioned about the threaded shaft. The ejector nut translates along the shaft as a function of the shaft's rotation, so as to permit the retraction of the ejector when an element is engaged in the coupler assembly or cause the ejector to extend into the coupler assembly to disengage the element. The direction and rotation of the motor is controlled by a system coupled to sensors positioned within the system. Such control system may include one or more processors, component interfaces, and data storage/memory. The sensors may include multiple optical, magnetic or mechanical means for monitoring one or more of the positions of the ejector nut and ejector along the threaded shaft, and/or the rotational position of the coupler assembly.",2024-01-02,2024
11859488,DAS data processing to identify fluid inflow locations and fluid type,"A method of identifying inflow locations along a wellbore includes obtaining an acoustic signal from a sensor within the wellbore, determining a plurality of frequency domain features from the acoustic signal, and identifying, using a plurality of fluid flow models, a presence of at least one of a gas phase inflow, an aqueous phase inflow, or a hydrocarbon liquid phase inflow at one or more fluid flow locations. The acoustic signal includes acoustic samples across a portion of a depth of the wellbore, and the plurality of frequency domain features are obtained across a plurality of depth intervals within the portion of the depth of the wellbore. Each fluid flow model of the plurality of fluid inflow models uses one or more frequency domain features of the plurality of the frequency domain features, and at least two of the plurality of fluid flow models are different.",2024-01-02,2024
11859626,Incipient compressor surge detection using artificial intelligence,"Examples described herein provide a computer-implemented method that includes receiving training data indicative of incipient compressor surge for cabin air compressors. The method further includes generating, using the training data, a training spectrogram. The method further includes training, by a processing system, a machine learning model to detect incipient compressor surge events for the cabin air compressors using the spectrogram. The method further includes receiving, at a microcontroller associated with a cabin air compressor, operating data associated with the cabin air compressor. The method further includes generating, at the microcontroller and using the operating data, an operating spectrogram. The method further includes detecting, by the microcontroller associated with the cabin air compressor, an incipient compressor surge event by applying the machine learning model to the operating spectrogram. The method further includes implementing a corrective action to correct the incipient compressor surge event.",2024-01-02,2024
11859847,Methods and systems for training building control using simulated and real experience data,"Systems and methods for training a reinforcement learning (RL) model for HVAC control are disclosed herein. Simulated experience data for the HVAC system is generated or received. The simulated experience data is used to initially train the RL model for HVAC control. The HVAC system operates within a building using the RL model and generates real experience data. A determination may be made to retrain the RL model. The real experience data is used to retrain the RL model. In some embodiments, both the simulated and real experience data are used to retrain the RL model. Experience data may be sampled according to various sampling functions. The RL model may be retrained multiple times over time. The RL model may be retrained less frequently over time as more real experience data is used to train the RL model.",2024-01-02,2024
11859973,Large scale CNN regression based localization via two-dimensional map,Embodiments described herein provide a processing apparatus comprising compute logic to train a convolutional neural network (CNN) to perform autonomous re-localization for a service robot or mobile device. In one embodiment the apparatus comprises an image processor to process visual data received via a sensor and a general purpose graphics processing engine perform camera pose estimation for image data and generate a transformation matrix to transform positions of camera pose estimations to positions within a human readable map of the location. The images and transformed positions are uses to train the CNN to perform re-localization.,2024-01-02,2024
11859985,Map data validation using knowledge graphs and randomness measures,Systems and methods are disclosed for improved mapping data validation using randomness measures. Methods may include receiving a map dataset that includes a plurality of map features. A knowledge graph may be generated based on the map dataset that may include nodes representing or corresponding to the map features. Nodes corresponding to map features of a particular feature type may be identified and edges connected to the identified nodes may be processed to identify a plurality of paths. A randomness measure for the particular feature type may be determined based on the plurality of paths. The randomness measure may indicate a predictability of occurrences of map features of the particular feature type in the map dataset. The randomness measure may then be compared to a second randomness measure determined based on another map dataset.,2024-01-02,2024
