id,title,abstract,patent_date,year
11861135,Aircraft spatial configuration difference display system,"A method, apparatus, system, and computer program product for visualizing aircraft configurations. A computer system determines a set of weight differences between weights for spatial zones in an aircraft and corresponding spatial zones in a comparison aircraft. The computer system displays a visual representation of the aircraft in a graphical user interface on a display system. The computer system displays the spatial zones in the visual representation of the aircraft in association with a set of graphical indicators identifying the set of weight differences between the spatial zones and the corresponding spatial zones in the graphical user interface on the display system. According to other illustrative embodiments, a computer system and a computer program product for visualizing aircraft configurations are provided.",2024-01-02,2024
11861136,"Systems, methods, and graphical user interfaces for interacting with virtual reality environments","A computer system displays a view of at least a portion of a simulated three-dimensional space, and a view of a user interface object located within the simulated three-dimensional space. The user interface object is a representation of a computing device that has a non-immersive display environment that provides access to a plurality of different applications. The user interface object includes a first user interface that corresponds to the non-immersive display environment of the computing device and is responsive to touch inputs from a user on the input device, and a pose of the user interface object in the simulated three-dimensional space corresponds to a pose of the input device in a physical space surrounding the input device. In response to a touch input that corresponds to a respective location in the first user interface, an appearance of the first user interface is updated.",2024-01-02,2024
11861150,Methods and apparatus for managing and exchanging information using information objects,"A computer-implemented method for interacting with at least one data item obtained from at least one source utilizes computer processes responsive to a user selection of the at least one data item and include causing configuring of each of the data items into a distinct information object by extracting, from each data item, extracted data including a picture, a heading, and a link to the data item, and causing storing of data corresponding to each of the information objects in a database system. The processes further include displaying a representation of each of at least two of the information objects in the database system, the representation being in a uniform format, wherein the format includes a card, and, within the card, in uniform locations thereof, the picture, the heading, a set of indicators, and a set of graphically accessible functions.",2024-01-02,2024
11861166,System and method for network interface controller based data deduplication,"Methods and systems for managing storage of data in a distributed system is disclosed. To manage storage of data in a distributed system, a data processing system may include a network interface controller (NIC). The NIC may present emulated storages that may be used for data storage. The emulated storage devices may utilize storage resources of storage devices. The NIC and the storage devices may implement a distributed deduplication process. The NIC may segment data into chunks and obtain fingerprints of the chunks. The fingerprints may be provided to the storage which may check the fingerprints against fingerprints of already stored chunks. The storage may request the chunks corresponding to the fingerprints that did not match any fingerprints of the already stored chunks. The NIC may provide only those requested chunks to the storage before discarding all of the chunks.",2024-01-02,2024
11861175,Latency in data storage systems,"A method, system, and computer program product are disclosed. The method includes receiving a write request to a system and calculating, based on operating parameters of the system, a total processing time associated with servicing the write request in the system. The method also includes determining an actual time taken to store data specified in the write request and, when the actual time is less than the total processing time, delaying sending a completion message for the write request to an I/O interface.",2024-01-02,2024
11861195,TLC data programming with hybrid parity,"The present disclosure generally relates to improving programming to data storage devices, such as solid state drives (SSDs). A first memory device has a first XOR element and a second memory device has a second XOR element. The ratio of the first XOR element to the capacity of the first memory device is substantially smaller than the ratio of the second XOR element to the capacity of the second memory device. A read verify operation to find program failures is executed on either a wordline to wordline basis, an erase block to erase block basis, or both a wordline to wordline basis and an erase block to erase block basis. Because the program failures are found and fixed prior to programming to the second memory device, the second XOR element may be decreased substantially.",2024-01-02,2024
11861199,Data management across a persistent memory tier and a file system tier,"Techniques are provided for data management across a persistent memory tier and a file system tier. A block within a persistent memory tier of a node is determined to have up-to-date data compared to a corresponding block within a file system tier of the node. The corresponding block may be marked as a dirty block within the file system tier. Location information of a location of the block within the persistent memory tier is encoded into a container associated with the corresponding block. In response to receiving a read operation, the location information is obtained from the container. The up-to-date data is retrieved from the block within the persistent memory tier using the location information for processing the read operation.",2024-01-02,2024
11861201,System and method for inline recovery of a file system resource allocator,"A method, computer program product, and computer system for maintaining a back pointer from a physical layer block (PLB) to a virtual layer block (VLB) in a multi-level hierarchical file system. A generation number may be maintained in the VLB, wherein the generation number may indicate when data is moved from the PLB to another PLB. An object may be reconstructed in the multi-level hierarchical file system based upon, at least in part, at least one of the back pointer and the generation number.",2024-01-02,2024
11861210,Data processing method and apparatus for solid state disk,"Disclosed is a method for data processing applied to a solid state drive, a computer device and a computer-readable storage medium. The method includes acquiring an interface protocol command received by the solid state drive. The method also includes parsing the interface protocol command to obtain I/O information from the interface protocol command. The I/O information includes at least an I/O timestamp, an I/O type, and an I/O size. The method further includes invoking machine learning based on the I/O information to predict I/O information of a first future time period, so that a processor of the solid state drive is configured to proactively execute management functions according to the prediction results.",2024-01-02,2024
11861214,Memory device forensics and preparation,"Example embodiments employ a selective memory swapping system for selectively placing non-volatile memory devices of a computer system offline, e.g., for background updating, and online, for use by a computer system, whereby the background updating process includes a mechanism for performing forensics analysis and updating of offline memory devices while an alternate memory device is usable by a user of the first computer system.",2024-01-02,2024
11861217,DRAM-less SSD with command draining,"A data storage device includes one or more memory device and a controller that is DRAM-less coupled to the one or more memory devices. The controller is configured to receive a command from a host device, begin execution of the command, and receive an abort request command for the command. The command includes pointers that direct the data storage device to various locations on the data storage device where relevant content is located. Once the abort command is received, the content of the host pointers stored in the data storage device RAM are changed to point to the HMB. The data storage device then waits until any already started transactions over the interface bus that are associated with the command have been completed. Thereafter, a failure completion command is posted to the host device.",2024-01-02,2024
11861224,Data transfer management from host buffers,"The present disclosure generally relates to efficient data transfer. Rather than processing each command, the data storage device fetches part of the host buffers and then makes a determination regarding the attributes of the fetched buffers. Upon the determination, the command is classified as optimized, not-optimized, or somewhere in between. Optimized commands are permitted to retrieve data out of order while non-optimized commands remain in a strict in order data retrieval process. In between commands can be processed with some out of order data retrieval. In so doing, data transfers are effectively managed and optimized data by taking into account the current attributes of the host buffers per command.",2024-01-02,2024
11861234,Dynamic adjustment of data storage for enhanced data retention,"A method includes receiving data to write to a memory sub-system including a single-level cell (SLC) cache and a multiple level cell (XLC) storage. The SLC cache includes a static SLC cache having a fixed size, and dynamic SLC cache having a default maximum size corresponding to a first mode of operation and an enhanced maximum size greater than the default maximum size corresponding to a second mode of operation. The method further includes, in response to determining to initiate a write operation in a first mode, initiating the write operation in the first mode to write a first portion of the data to the SLC cache, and in response to determining that a logical saturation of the first portion of the data satisfies the first threshold condition, continuing the write operation in the second mode to write a second portion of the data to the SLC cache.",2024-01-02,2024
11861263,Robust natural language based control of computer applications,"This specification is generally directed to techniques for robust natural language (NL) based control of computer applications. In many implementations, the NL control is at least selectively interactive in that the user feedback input is solicited, and received, in resolving action(s), resolving action set(s), generating domain specific knowledge, and/or in providing feedback on implemented action set(s). The user feedback input can be utilized in further training of machine learning model(s) utilized in the NL based control of the computer applications.",2024-01-02,2024
11861276,Locating a center point of a lug nut for an automated vehicle wheel removal system,"Described is a system (and method) for locating a center point of a lug nut for an automated vehicle wheel removal system. To improve the accuracy of the center point, the system may perform machine learning inferences using two-dimensional (2D) and three-dimensional (3D) image data. The system may process a 2D image to infer an initial center point, and potentially improve the accuracy by leveraging a 3D image. More particularly, the system may process a 3D image to infer a location of one or more edges (or edge points) around the perimeter of the lug nut and measure a set of distances between the initial center point and the located set of edges. The system may then refine (or adjust) the center point based on such measurements.",2024-01-02,2024
11861280,"Device for generating verification vector for circuit design verification, circuit design system, and reinforcement learning method of the device and the circuit design system","A method of reinforcement learning of a neural network device for generating a verification vector for verifying a circuit design comprising a circuit block includes inputting a test vector to the circuit block, generating one or more rewards based on a coverage corresponding to the test vector, the coverage being determined based on a state transition of the circuit block based on the test vector, and applying the one or more rewards to a reinforcement learning.",2024-01-02,2024
11861295,Encoding a job posting as an embedding using a graph neural network,"Described herein are techniques for using a graph neural network to encode online job postings as embeddings. First, an input graph is defined by processing one or more rules to discover edges that connect nodes in an input graph, where the nodes of the input graph represent job postings or standardized job attributes, and the edges are determined based on analyzing a log of user activity directed to online job postings. Next, a graph neural network (GNN) is trained based on an edge prediction task. Finally, once trained, the GNN is used to derive node embeddings for the nodes (e.g., job postings) of the input graph, and in some instances, new online job postings not represented in the original input graph.",2024-01-02,2024
11861301,Part sorting system,"A method, apparatus, and computer system for grouping parts. Sets of unigrams are generated from text in part lists for parts in a family of parts using natural language processing, wherein a set of unigrams in the sets of unigrams represent components for a part in the parts. A document term matrix is created using the sets of unigrams. The document term matrix describes a presence of components in the parts. A number of unigrams from the document term matrix that has occurrences in the document term matrix that are greater than a common design threshold is removed. Removing the number of unigrams from the document term matrix forms a processed document term matrix. The common design threshold identifies a level of occurrence not useful in differentiating the parts from each other. The parts are clustered into groups using the processed document term matrix.",2024-01-02,2024
11861307,"Request paraphrasing system, request paraphrasing model and request determining model training method, and dialogue system","A request paraphrasing system 120 allowing a dialogue system to flexibly address to requests in various different manners of expression includes: a pre-processing unit 130 converting a user input 56 to a word vector sequence; and a neural paraphrasing model 94 trained in advance by machine learning to receive the word vector sequence as an input and paraphrasing a request represented by the word vector sequence to a request having a higher probability of obtaining an answer from a question-answering device 122 than the request before paraphrasing. As pre-processing, whether the user input 56 is a request or not may be determined and it may be paraphrased only when it is determined to be a request. Further, a classification model 98 may classify the input request to determine to which request class it belongs, and the classification may be input as one feature to neural paraphrasing model 94. ",2024-01-02,2024
11861308,Mapping natural language utterances to operations over a knowledge graph,"Certain aspects of the present disclosure provide techniques for processing natural language utterances in a knowledge graph. An example method generally includes receiving a long-tail query comprising a natural language utterance from a user of an application. Operands and operators are extracted from the natural language utterance using a natural language model. Operands may be mapped to nodes in a knowledge graph, the nodes representing values calculated from data input into the application, and operators may be mapped to operations to be performed on data extracted from the knowledge graph. The functions associated with the operators are executed using data extracted from the nodes in the knowledge graph associated with the operands to generate a query result. The query result is returned as a response to the received long-tail query.",2024-01-02,2024
11861311,System and method for knowledge graph construction using capsule neural network,"A system for knowledge graph construction. The system includes a computing device. The computing device has a processor and a storage device storing computer executable code. The computer executable code, when executed at the processor, is configured to: define entities and relations of the knowledge graph; provide documents having sentences; convert the sentences into fix length sentence embeddings and regard the sentence embeddings as primary capsule layers; use a set transformer to learn entity capsules and relation capsules from the primary capsule layers; for each triple, project head and tail entities from entity space to the specific relation space, and determine the relation exists when the sum of the projected head entity vector and the relation vector substantially equals to the projected tail entity vector; and construct the knowledge graph using the head entity, the tail entity, and the determined relation.",2024-01-02,2024
11861312,Content evaluation based on machine learning and engagement metrics,"Techniques for machine learning analysis are provided. A machine learning (ML) model is trained to identify appropriate documents based on lexical knowledge of target groups. A lexical knowledge of a set of users is determined. Additionally, a first document of a plurality of documents is selected by processing the determined level of lexical knowledge using the ML model. The first document is presented to the set of users. A level of engagement of the set of users is then determined. Upon determining that the level of engagement is below a predefined threshold, a second document of the plurality of documents is selected using the ML model.",2024-01-02,2024
11861317,Ensemble-based machine learning characterization of human-machine dialog,"Human-machine dialog is characterized by receiving data comprising a recording of an individual interacting with a dialog application simulating a conversation. Thereafter, the received data is parsed using automated speech recognition to result in text comprising a plurality of words. Features are extracted from the parsed data and then input an ensemble of different machine learning models each trained to generate a score characterizing a plurality of different dialog constructs. Thereafter, scores generated by the machine learning models for each of the dialog constructs are fused. A performance score is then generated based on the fused scores which characterizes a conversational proficiency of the individual interacting with the dialog application. Data can then be provided which includes or otherwise characterizes the generated score. Related apparatus, systems, techniques and articles are also described.",2024-01-02,2024
11861318,"Method for providing sentences on basis of persona, and electronic device supporting same","An electronic device according to various embodiments of the present invention may include a memory, and at least one processor, wherein the at least one processor may be configured to obtain a sentence based on a user input, based on obtaining the sentence, determine at least one persona, convert the sentence to at least one sentence having a style corresponding to the at least one persona, using a neural network, and provide the converted at least one sentence.",2024-01-02,2024
11861320,Text reduction and analysis interface to a text generation modeling system,A query request identifying a query and a plurality of text portions for determining an answer to the query may be received. Relevance scores corresponding with respective ones of the text portions may be determined based on application of one or more machine learning models to the respective text portion and the query. A subset of the text portions may be selected based on the relevance scores. A response message to the query request including an answer to the query in natural language text generated by a large language model based on the first subset of text portions may be determined.,2024-01-02,2024
11861331,"Scaling high-level statistical languages to large, distributed datasets",A system and method for performing large-scale data processing using a statistical programming language are disclosed. One or more high-level statistical operations may be received. The received high-level statistical operations may be dynamically translated into a graph of low-level data operations. The unnecessary operations may be removed and operations may be fused or chained together. Operations may then be grouped into distributed data processing operation. The low-level operations may then be run.,2024-01-02,2024
11861333,Augmentation of code completion and code synthesis with semantic checking,"A method for providing autofill suggestions in a development environment includes obtaining, from a user interface executing on a user device, a user input representing source code generated within a development environment. The source code created using a particular programming language and a programming code base. The method further includes determining, using a machine learning model, at least one autofill suggestion based on the user input, the autofill suggestion continuing the source code represented by the user input. The method further includes determining, using a rule-based semantic checker configured for the particular programming language, whether the autofill suggestion is semantically correct based on the development environment and the programming code base. The method also includes, when the autofill suggestion is semantically correct, transmitting the autofill suggestion for display on the user interface of the user device.",2024-01-02,2024
11861335,Learn to extract from syntax tree,A system deploying a machine learning technique that utilizes known code graph and abstract syntax tree pairs for known JSON objects to learn a function for predicting a corresponding abstract syntax tree from a new JSON object. The predicted abstract syntax tree is used to generate code for formatting the new JSON object into a standardized data structure.,2024-01-02,2024
11861336,Software systems and methods for multiple TALP family enhancement and management,"Software systems and methods convert algorithms and software codes into time affecting linear pathways (TALPs) via decomposition and convert paired Input/Output (I/O) datasets into TALPs via Value Complexity polynomials. Generated TALPs can be enhanced through merging with other TALPs. TALPs can be grouped by matching the outputs of the TALP-associated prediction polynomials with some set of given criteria into families and cross-families that are useful in a new type of software optimization that allows for output values of grouped TALPs to be modeled, pooled, discretized and optimized to enhance goals or meet user goals.",2024-01-02,2024
11861337,Deep neural networks compiler for a trace-based accelerator,"A method of compiling neural network code to executable instructions for execution by a computational acceleration system having a memory circuit and one or more acceleration circuits having a maps data buffer and a kernel data buffer is disclosed, such as for execution by an inference engine circuit architecture which includes a matrix-matrix (MM) accelerator circuit having multiple operating modes to provide a complete matrix multiplication. A representative compiling method includes generating a list of neural network layer model objects; fusing available functions and layers in the list; selecting a cooperative mode, an independent mode, or a combined cooperative and independent mode for execution; selecting a data movement mode and an ordering of computations which reduces usage of the memory circuit; generating an ordered sequence of load objects, compute objects, and store objects; and converting the ordered sequence of load objects, compute objects, and store objects into the executable instructions.",2024-01-02,2024
11861342,Enhanced cloud-computing environment deployment,"Methods, systems, and apparatus, including computer programs encoded on computer-storage media, for enhanced cloud computing deployment. In some implementations, a computer system provides a repository comprising (i) deployment tools configured to provide a deployment application programming interface (API), (ii) a set of container files configured to operate together to provide a server environment, and (iii) configuration data for the container images. The computer system can provide a deployment workflow package that, when invoked for a cloud computing account of the customer, is configured to retrieve the container files, configuration data, and deployment tools from the repository over a communication network and store the retrieved items in the cloud computing account. The deployment workflow package is also configured to run the deployment tools and create deployment infrastructure in the cloud computing account.",2024-01-02,2024
