id,title,abstract,patent_date,year
11861772,Generating images for virtual try-on and pose transfer,"In implementations of systems for generating images for virtual try-on and pose transfer, a computing device implements a generator system to receive input data describing a first digital image that depicts a person in a pose and a second digital image that depicts a garment. Candidate appearance flow maps are computed that warp the garment based on the pose at different pixel-block sizes using a first machine learning model. The generator system generates a warped garment image by combining the candidate appearance flow maps as an aggregate per-pixel displacement map using a convolutional gated recurrent network. A conditional segment mask is predicted that segments portions of a geometry of the person using a second machine learning model. The generator system outputs a digital image that depicts the person in the pose wearing the garment based on the warped garment image and the conditional segmentation mask using a third machine learning model.",2024-01-02,2024
11861780,Point cloud data management using key value pairs for class based rasterized layers,"A computer implemented method rasterizes point cloud data. A number of processor units rasterizes the point cloud data into rasterized layers based on classes in which each rasterized layer in the rasterized layers corresponds to a class in the classes. The number of processor units creates key value pairs from the rasterized layers. The number of processor units store the key value pairs in a key value store. According to other illustrative embodiments, a computer system and a computer program product for rasterizing point cloud data are provided.",2024-01-02,2024
11861806,End-to-end camera calibration for broadcast video,"A system and method of calibrating a broadcast video feed are disclosed herein. A computing system retrieves a plurality of broadcast video feeds that include a plurality of video frames. The computing system generates a trained neural network, by generating a plurality of training data sets based on the broadcast video feed and learning, by the neural network, to generate a homography matrix for each frame of the plurality of frames. The computing system receives a target broadcast video feed for a target sporting event. The computing system partitions the target broadcast video feed into a plurality of target frames. The computing system generates for each target frame in the plurality of target frames, via the neural network, a target homography matrix. The computing system calibrates the target broadcast video feed by warping each target frame by a respective target homography matrix.",2024-01-02,2024
11861807,Method of color decomposition and method of demosaicing images based on deep learning using the same,"In a method of color decomposition, inter-color images indicating similarity between color sensitivities are generated based on color images. Conversion coefficients of the color images and the inter-color images with respect to a white image are determined. A pseudo-white image corresponding to the color images and the inter-color images is generated using the conversion coefficients the pseudo-white image similar to a real white image is generated using the inter-color images indicating similarity between color sensitivities. Deep learning of the artificial neural network is performed efficiently using the color images and the pseudo-white image and the demosaiced images of high quality are generated using the trained artificial neural network that is trained.",2024-01-02,2024
11861808,"Electronic device, image processing method, and computer-readable recording medium","An electronic device is disclosed. The electronic device of the disclosure comprises: a memory in which a learned artificial intelligence model is stored; and a processor for inputting an input image to the artificial intelligence model and outputting an enlarged image with increased resolution, wherein the learned artificial intelligence model includes an upscaling module for acquiring the pixel values of interpolated pixels around a cell according to a function having a nonlinearly decreasing symmetric form with reference to an original pixel in the enlarged image, the original pixel corresponding to a pixel of the input image.",2024-01-02,2024
11861809,Electronic apparatus and image processing method thereof,"An electronic apparatus is disclosed. The electronic apparatus includes a memory storing at least one instruction, and a processor, electrically connected to the memory, configured to, by executing the instruction, obtain, from an input image, a noise map corresponding to the input image; provide the input image to an input layer of a learning network model including a plurality of layers, the learning network model being an artificial intelligence (AI) model that is obtained by learning, through an AI algorithm, a relationship between a plurality of sample images, a respective noise map of each of the plurality of sample images, and an original image corresponding to the plurality of sample images; provide the noise map to at least one intermediate layer among the plurality of layers; and obtain an output image based on a result from providing the input image and the noise map to the learning network model.",2024-01-02,2024
11861811,Neural network system with temporal feedback for denoising of rendered sequences,A neural network-based rendering technique increases temporal stability and image fidelity of low sample count path tracing by optimizing a distribution of samples for rendering each image in a sequence. A sample predictor neural network learns spatio-temporal sampling strategies such as placing more samples in dis-occluded regions and tracking specular highlights. Temporal feedback enables a denoiser neural network to boost the effective input sample count and increases temporal stability. The initial uniform sampling step typically present in adaptive sampling algorithms is not needed. The sample predictor and denoiser operate at interactive rates to achieve significantly improved image quality and temporal stability compared with conventional adaptive sampling techniques.,2024-01-02,2024
11861816,System and method for detecting image forgery through convolutional neural network and method for providing non-manipulation detection service using the same,A system and a method for detecting image forgery through a convolutional neural network are capable of detecting image manipulation of compressed and/or color images. The system comprises a manipulated feature pre-processing unit applying an input image to a high-pass filter to enhance features due to image forgery; a manipulated feature extraction unit extracting image manipulated feature information from the image with the enhanced features through a pre-trained convolutional neural network; a feature refining unit refining the extracted image manipulated feature information; and a manipulation classifying unit determining the image forgery based on the image manipulated feature information refined by the feature refining unit.,2024-01-02,2024
11861817,"Method implemented by a data processing apparatus, and charged particle beam device for inspecting a specimen using such a method","The invention relates to a method implemented by a data processing apparatus, comprising the steps of receiving an image; providing a set-point for a desired image quality parameter of said image; and processing said image using an image analysis technique for determining a current image quality parameter of said image. In the method, the current image quality parameter is compared with said desired set-point. Based on said comparison, a modified image is generated by using an image modification technique. The generating comprises the steps of improving said image in terms of said image quality parameter in case said current image quality parameter is lower than said set-point; and deteriorating said image in terms of said image quality parameter in case said current image quality parameter exceeds said set-point. The modified image is then output.",2024-01-02,2024
11861818,Cascade defect inspection,"A defect inspection system is disclosed. According to certain embodiments, the system includes a memory storing instructions implemented as a plurality of modules. Each of the plurality of modules is configured to detect defects having a different property. The system also includes a controller configured to cause the computer system to: receive inspection data representing an image of a wafer; input the inspection data to a first module of the plurality of modules, the first module outputs a first set of points of interests (POIs) having a first property; input the first set of POIs to a second module of the plurality of modules, the second module output a second set of POIs having the second property; and report that the second set of POIs as defects having both the first property and the second property.",2024-01-02,2024
11861821,System for measuring objects in tally operations using computer vision object detection methodologies,"Stock management for wood and lumber products requires measuring and counting items individually on a continuous basis; considering a single lumber package alone can contain hundreds of pieces, it is a tedious task that is error prone when done manually. The invention provides a technology solution that involves taking a picture of products using a smart-phone, or a tablet's built-in camera, processing said picture data to detect individual items using Artificial Intelligence Object Detection methods, and utilizing special algorithms to measure and compute unit volume to present the user a detailed description, measure, count, and a summary. This process helps identify and take stock counts faster and with higher accuracy.",2024-01-02,2024
11861825,Interactive coronary labeling using interventional X-ray images and deep learning,"A method for classifying a vasculature comprises training a training device with an initial model of a vasculature using diagnostic image data representing a geometry for a plurality of vessels of a vessel tree and including a respective vessel labeling for each vessel, providing at least one diagnostic image of a patient's vessel tree and identifying a variation between the vessel tree represented by the initial model and the patients vessel tree. This variation is checked and labeled in order to improve the trained model. The process may be repeated iteratively until reaching an accurate patient-specific model of the vasculature.",2024-01-02,2024
11861826,Imaging data processing device,"At the time of superimposing and aligning a stained image and a mass spectrometric (MS) image obtained for the same sample, an image display processor displays, on the superimposed images, grid lines (62) at the spacing corresponding to an operation of a grid spacing adjustment slider (63). When an operator depresses an image deformation range “SET” button (64), specifies an arbitrary area on the superimposed images with a mouse, and then depresses a “SELECT” button (65), an image deformation range specification receiving section determines an image deformation range. When the operator selects an intersection (grid point) of the grid lines (62) within the image deformation range and performs an operation of moving the intersection point to an arbitrary position, an image deformation processor deforms an image included in the image deformation range in accordance with the operation. The image deformation range can be set irrespective of the grid-line spacing, so that it is possible to perform accurate image deformation in accordance with the amount and range of deformation for each site on the image, and improve work efficiency.",2024-01-02,2024
11861827,Techniques for automatically characterizing liver tissue of a patient,"The disclosure relates to techniques for automatically characterizing liver tissue of a patient, comprising receiving morphological magnetic resonance image data set and at least one magnetic resonance parameter map of an imaging region comprising at least partially the liver of the patient, each acquired by a magnetic resonance imaging device, via a first interface. The techniques further include applying a trained function comprising a neural network to input data comprising at least the image data set and the parameter map. At least one tissue score describing the liver tissue is generated as output data, which is provided using a second interface.",2024-01-02,2024
11861828,Automated estimation of midline shift in brain ct images,Systems and methods for quantifying a shift of an anatomical object of a patient are provided. A 3D medical image of an anatomical object of a patient is received. An initial location of landmarks on the anatomical object in the 3D medical image is determined using a first machine learning network. A 2D slice depicting the initial location of the landmarks is extracted from the 3D medical image. The initial location of the landmarks in the 2D slice is refined using a second machine learning network. A shift of the anatomical object is quantified based on the refined location of the landmarks in the 2D slice. The quantified shift of the anatomical object is output.,2024-01-02,2024
11861829,Deep learning based medical image detection method and related device,"The present disclosure provides a deep learning based medical image detection method and apparatus, a computer-readable medium, and an electronic device. The method includes: acquiring a to-be-detected medical image comprising a plurality of slices; for each slice in the to-be-detected medical image: extracting N basic feature maps of the slice by a deep neural network, N being an integer greater than 1, merging features of the N basic feature maps by the deep neural network, to obtain M enhanced feature maps, M being an integer greater than 1, and respectively performing a hierarchically dilated convolutions operation on the M enhanced feature maps by the deep neural network, to generate a superposed feature map of each enhanced feature map; and predicting position information of a region of interest and a confidence score thereof in the to-be-detected medical image by the deep neural network based on the superposed feature map.",2024-01-02,2024
11861831,Systems and methods for processing electronic images to predict lesions,"Systems and methods are disclosed for predicting the location, onset, or change of coronary lesions from factors like vessel geometry, physiology, and hemodynamics. One method includes: acquiring, for each of a plurality of individuals, a geometric model, blood flow characteristics, and plaque information for part of the individual's vascular system; training a machine learning algorithm based on the geometric models and blood flow characteristics for each of the plurality of individuals, and features predictive of the presence of plaque within the geometric models and blood flow characteristics of the plurality of individuals; acquiring, for a patient, a geometric model and blood flow characteristics for part of the patient's vascular system; and executing the machine learning algorithm on the patient's geometric model and blood flow characteristics to determine, based on the predictive features, plaque information of the patient for at least one point in the patient's geometric model.",2024-01-02,2024
11861832,Automatically determining a brock score,"Disclosed is a system and a method for determining a brock score. A CT scan image may be resampled into a plurality of slices using a bilinear interpolation. A nodule may be detected on one or more of the plurality of slices. A region of interest associated with the nodule may be identified using an image processing technique. Further, a nodule segmentation may be performed to remove an area surrounding the region of interest. Subsequently, a plurality of characteristics associated with the nodule may be identified automatically using a deep learning model. Finally, a brock score for the patient may be determined based on the plurality of characteristics and demographic data of the patient.",2024-01-02,2024
11861835,Automatic hemorrhage expansion detection from head CT images,Systems and methods for assessing expansion of an abnormality are provided. A first input medical image of a patient depicting an abnormality at a first time and a second input medical image of the patient depicting the abnormality at a second time are received. The second input medical image is registered with the first input medical image. The abnormality is segmented from 1) the first input medical image to generate a first segmentation map and 2) the registered second input medical image to generate a second segmentation map. The first segmentation map and the second segmentation map are combined to generate a combined map. Features are extracted from the first input medical image and the registered second input medical image are based on the combined map. Expansion of the abnormality is assessed based on the extracted features using a trained machine learning based network. Results of the assessment are output.,2024-01-02,2024
11861838,Systems and methods for system agnostic automated detection of cardiovascular anomalies and/or other features,"Systems and methods are provided for processing image data generated by a medical imaging system such as an ultrasound or echocardiogram system using artificial intelligence and machine learning to determine a presence of one or more congenital heart defects (CHDs) and/or other cardiovascular anomalies in the image data in a manner that is agnostic to the type of imaging system, software, and/or hardware. Image data from various types imaging systems, software, and/or hardware, having various styles of imaging data generated may be processed to determine image styles. Input image data for analysis may then be processed together with representative styles of image data to generate styled input images for each style. The styled input images may be processed by an image analyzer to detect one or more cardiovascular anomalies in the styled image data, for example. Alternatively, training data may be styled and used to train the image analyzer.",2024-01-02,2024
11861839,Preprocessing medical image data for machine learning,"A system and computer-implemented method are provided for preprocessing medical image data for machine learning. Image data is accessed which comprises an anatomical structure. The anatomical structure in the image data is segmented to obtain a segmentation of the anatomical structure as a delineated part of the image data. A grid is assigned to the delineated part of the image data, the grid representing a partitioning of an exterior and interior of the type of anatomical structure using grid lines, wherein said assigning comprises adapting the grid to fit the segmentation of the anatomical structure in the image data. A machine learning algorithm is then provided with an addressing to the image data in the delineated part on the basis of coordinates in the assigned grid. In some embodiments, the image data of the anatomical structure may be resampled using the assigned grid. Advantageous, a standardized addressing to the image data of the anatomical structure is provided, which may reduce the computational overhead of the machine learning, require fewer training data, etc.",2024-01-02,2024
11861846,Correcting segmentation of medical images using a statistical analysis of historic corrections,"Disclosed is a computer-implemented methods of determining distributions of corrections for correcting the segmentation of medical image data, determining corrections for correcting the segmentation of medical image data, training a learning algorithm for determining a segmentation of a digital medical image, and determining a relation between an image representation of the anatomical body part in an individual medical image and a label to be associated with the image representation of the anatomical body part in the individual medical image using the trained machine learning algorithm. The methods encompass reading a plurality of corrections to image segmentations, wherein the corrections themselves may have been manually generated, transforming these corrections into a reference system which is not patient-specific such as an atlas reference system, conducting a statistical analysis of the correction, and applying the re-transformed result of the statistical analysis to patient images. The result of the statistical analysis may also be used to appropriately train a machine learning algorithm for automatic segmentation of patient images. The application of such a trained machine learning algorithm is also part of this disclosure.",2024-01-02,2024
11861850,System and method for player reidentification in broadcast video,"A system and method of re-identifying players in a broadcast video feed are provided herein. A computing system retrieves a broadcast video feed for a sporting event. The broadcast video feed includes a plurality of video frames. The computing system generates a plurality of tracks based on the plurality of video frames. Each track includes a plurality of image patches associated with at least one player. Each image patch of the plurality of image patches is a subset of the corresponding frame of the plurality of video frames. For each track, the computing system generates a gallery of image patches. A jersey number of each player is visible in each image patch of the gallery. The computing system matches, via a convolutional autoencoder, tracks across galleries. The computing system measures, via a neural network, a similarity score for each matched track and associates two tracks based on the measured similarity.",2024-01-02,2024
11861851,Anatomical and functional assessment of CAD using machine learning,"Anatomical and functional assessment of coronary artery disease (CAD) using machine learning and computational modeling techniques deploying methodologies for non-invasive Fractional Flow Reserve (FFR) quantification based on angiographically derived anatomy and hemodynamics data, relying on machine learning algorithms for image segmentation and flow assessment, and relying on accurate physics-based computational fluid dynamics (CFD) simulation for computation of the FFR.",2024-01-02,2024
11861853,System and method of vehicle speed estimation using moving camera and time series neural network,"A system, apparatus and method of embedded ego vehicle speed estimation apparatus, including a car-mounted monocular camera for capturing a sequence of video frames of an outdoor scene from a moving car, where the outdoor scene includes a road, as a camera channel, and processing circuitry. The processing circuitry is configured with a single-shot network and a 3D convolutional neural network (3D-CNN), the single-shot network segments features of the road in the video frame sequence and generates a masked-attention map for the segmented road features, a concatenation circuit concatenates the masked-attention map as an additional channel to the camera channel to generate a masked-attention input, and the 3D-CNN network receives the masked-attention input and generates an estimated speed of the ego vehicle based on displacement of the segmented road features in the video sequences.",2024-01-02,2024
11861854,Dense feature scale detection for image matching,"Dense feature scale detection can be implemented using multiple convolutional neural networks trained on scale data to more accurately and efficiently match pixels between images. An input image can be used to generate multiple scaled images. The multiple scaled images are input into a feature net, which outputs feature data for the multiple scaled images. An attention net is used to generate an attention map from the input image. The attention map assigns emphasis as a soft distribution to different scales based on texture analysis. The feature data and the attention data can be combined through a multiplication process and then summed to generate dense features for comparison.",2024-01-02,2024
11861871,Crack evaluation of roofing membrane by artificial neural networks,"A method and system for evaluating crack intensity on polymeric sheet based on predetermined scale of crack intensity grades, which includes the steps of a) recording digital image of at least portion of surface of polymeric sheet using apparatus for recording digital images; and b) automatic classification of crack intensity by computer-implemented program for pattern recognition by means of trained artificial neural network, including 1) inputting digital image or one or more subareas of digital image to trained artificial neural network as input data, 2) classification by artificial neural network by assigning grade from predetermined scale of crack intensity grades to digital image or one or more subareas and 3) outputting assigned grade or grades for digital image and/or one or more subareas as output data, wherein artificial neural network is trained in advance in learning phase with plurality of digital images or subareas thereof of polymeric sheet surface portions.",2024-01-02,2024
